{
  "schema_version": 1,
  "risk_tier": 2,
  "base_revision": "content:e2744b65b627ba2bd2e085a99d29d10b7ee07b6f46ece909ba288443c6ea38ad",
  "domains": [
    "ui-ux"
  ],
  "task_id": "plugin-products",
  "title": "Grouped plugins, explicit format removal and multiple sound folders",
  "state": "complete",
  "product_decisions_needed": [],
  "acceptance_criteria": [
    {
      "id": "AC1",
      "statement": "Grouped products and member search",
      "status": "passed",
      "evidence": [
        ".workflow/evidence/plugin-products/delivery-report.json",
        ".workflow/evidence/plugin-products/native-runtime-report.json",
        ".workflow/evidence/plugin-products/source-review-report.json"
      ]
    },
    {
      "id": "AC2",
      "statement": "Reviewed selective Trash and safety boundaries",
      "status": "passed",
      "evidence": [
        ".workflow/evidence/plugin-products/delivery-report.json",
        ".workflow/evidence/plugin-products/native-runtime-report.json",
        ".workflow/evidence/plugin-products/source-review-report.json"
      ]
    },
    {
      "id": "AC3",
      "statement": "Multiple roots persist and scan",
      "status": "passed",
      "evidence": [
        ".workflow/evidence/plugin-products/delivery-report.json",
        ".workflow/evidence/plugin-products/native-runtime-report.json",
        ".workflow/evidence/plugin-products/source-review-report.json"
      ]
    },
    {
      "id": "AC4",
      "statement": "Native formats and folder UI",
      "status": "passed",
      "evidence": [
        ".workflow/evidence/plugin-products/delivery-report.json",
        ".workflow/evidence/plugin-products/native-runtime-report.json",
        ".workflow/evidence/plugin-products/source-review-report.json"
      ]
    },
    {
      "id": "AC5",
      "statement": "Regression and independent review",
      "status": "passed",
      "evidence": [
        ".workflow/evidence/plugin-products/delivery-report.json",
        ".workflow/evidence/plugin-products/native-runtime-report.json",
        ".workflow/evidence/plugin-products/source-review-report.json"
      ]
    }
  ],
  "gates": {
    "research": {
      "status": "passed",
      "evidence": [
        ".workflow/evidence/plugin-products/research.json"
      ],
      "revision": "content:2a5e5d3e8b8442a82e2a9d5d215654123e77234f1ef0cf48afd7e77170827bc1",
      "agent": "researcher"
    },
    "plan_review": {
      "status": "passed",
      "evidence": [
        ".workflow/evidence/plugin-products/plan_review.json"
      ],
      "revision": "content:2a5e5d3e8b8442a82e2a9d5d215654123e77234f1ef0cf48afd7e77170827bc1",
      "agent": "critic"
    },
    "implementation": {
      "status": "passed",
      "evidence": [
        ".workflow/evidence/plugin-products/implementation.json"
      ],
      "revision": "content:2a5e5d3e8b8442a82e2a9d5d215654123e77234f1ef0cf48afd7e77170827bc1",
      "agent": "implementer"
    },
    "automated_tests": {
      "status": "passed",
      "evidence": [
        ".workflow/evidence/plugin-products/automated_tests.json"
      ],
      "revision": "content:2a5e5d3e8b8442a82e2a9d5d215654123e77234f1ef0cf48afd7e77170827bc1",
      "agent": "scripts/run_check.py"
    },
    "code_review": {
      "status": "passed",
      "evidence": [
        ".workflow/evidence/plugin-products/code_review.json"
      ],
      "revision": "content:2a5e5d3e8b8442a82e2a9d5d215654123e77234f1ef0cf48afd7e77170827bc1",
      "agent": "reviewer"
    },
    "runtime_tests": {
      "status": "passed",
      "evidence": [
        ".workflow/evidence/plugin-products/runtime_tests.json"
      ],
      "revision": "content:2a5e5d3e8b8442a82e2a9d5d215654123e77234f1ef0cf48afd7e77170827bc1",
      "agent": "qa"
    },
    "ui_research": {
      "status": "passed",
      "evidence": [
        ".workflow/evidence/plugin-products/ui_research.json"
      ],
      "revision": "content:2a5e5d3e8b8442a82e2a9d5d215654123e77234f1ef0cf48afd7e77170827bc1",
      "agent": "ux-architect"
    },
    "design_system_audit": {
      "status": "passed",
      "evidence": [
        ".workflow/evidence/plugin-products/design_system_audit.json"
      ],
      "revision": "content:2a5e5d3e8b8442a82e2a9d5d215654123e77234f1ef0cf48afd7e77170827bc1",
      "agent": "ux-reviewer"
    },
    "accessibility": {
      "status": "passed",
      "evidence": [
        ".workflow/evidence/plugin-products/accessibility.json"
      ],
      "revision": "content:2a5e5d3e8b8442a82e2a9d5d215654123e77234f1ef0cf48afd7e77170827bc1",
      "agent": "accessibility-tester"
    },
    "visual_regression": {
      "status": "passed",
      "evidence": [
        ".workflow/evidence/plugin-products/visual_regression.json"
      ],
      "revision": "content:2a5e5d3e8b8442a82e2a9d5d215654123e77234f1ef0cf48afd7e77170827bc1",
      "agent": "visual-regression-tester"
    },
    "ux_review": {
      "status": "passed",
      "evidence": [
        ".workflow/evidence/plugin-products/ux_review.json"
      ],
      "revision": "content:2a5e5d3e8b8442a82e2a9d5d215654123e77234f1ef0cf48afd7e77170827bc1",
      "agent": "ux-reviewer"
    }
  },
  "current_revision": "content:2a5e5d3e8b8442a82e2a9d5d215654123e77234f1ef0cf48afd7e77170827bc1"
}
